{
  "id": "122",
  "summary": {
    "reconstructed_session_id": "122",
    "event_count": 2,
    "duration_seconds": 0.0,
    "first_event_utc": "2020-02-14T04:21:26.532921+00:00",
    "last_event_utc": "2020-02-14T04:21:26.532921+00:00",
    "context": {
      "honeypot": "dionaea",
      "protocol": "FTP",
      "country": "Japan",
      "country_code": "JP"
    },
    "classification": {
      "attack_type": "FTP Brute Force",
      "mitre_technique": "T1110",
      "attack_stage": "Credential Access",
      "severity": "Medium"
    },
    "source_ips": [
      "172.105.218.213"
    ],
    "credentials": {
      "unique_usernames": [
        "Administrator",
        "sa"
      ],
      "unique_passwords_count": 1,
      "auth_attempt_total": 2,
      "user_attempt_total": 2,
      "pass_attempt_total": 1,
      "anonymous_total": 0
    },
    "commands": {
      "command_count_total": 0,
      "unique_commands_count": 0,
      "sample_commands": []
    },
    "flags": {
      "is_suspicious": true,
      "is_brute_force_candidate": false,
      "has_commands_executed": false,
      "has_attack_classification": true,
      "is_large_session": false,
      "is_long_running": false,
      "is_multi_ip": false,
      "is_high_severity": false,
      "is_medium_or_higher_severity": true
    }
  },
  "narrative": {
    "steps": [
      {
        "index": 1,
        "offset_seconds": 0.0,
        "phase": "connection",
        "step_type": "connection",
        "icon": "🚪",
        "title": "CONNECTION ESTABLISHED",
        "details": [
          {
            "label": "From",
            "value": "172.105.218.213:60492.0"
          },
          {
            "label": "Port",
            "value": 21.0
          },
          {
            "label": "Protocol",
            "value": "FTP"
          },
          {
            "label": "Honeypot",
            "value": "dionaea"
          },
          {
            "label": "Username",
            "value": "sa"
          },
          {
            "label": "Password",
            "value": "saadmin"
          },
          {
            "label": "Auth attempts",
            "value": 1
          },
          {
            "label": "User attempts",
            "value": 1
          },
          {
            "label": "Pass attempts",
            "value": 1
          },
          {
            "label": "Attack type",
            "value": "FTP Brute Force"
          },
          {
            "label": "MITRE",
            "value": "T1110"
          },
          {
            "label": "Stage",
            "value": "Credential Access"
          },
          {
            "label": "Severity",
            "value": "Medium"
          },
          {
            "label": "Event",
            "value": "1/2"
          }
        ],
        "timestamp": "2020-02-14T04:21:26.532921+00:00"
      },
      {
        "index": 2,
        "offset_seconds": 0.0,
        "phase": "disconnect",
        "step_type": "disconnect",
        "icon": "🔚",
        "title": "SESSION ENDED",
        "details": [
          {
            "label": "From",
            "value": "172.105.218.213:60492.0"
          },
          {
            "label": "Port",
            "value": 21.0
          },
          {
            "label": "Protocol",
            "value": "FTP"
          },
          {
            "label": "Honeypot",
            "value": "dionaea"
          },
          {
            "label": "Username",
            "value": "Administrator"
          },
          {
            "label": "Auth attempts",
            "value": 1
          },
          {
            "label": "User attempts",
            "value": 1
          },
          {
            "label": "Attack type",
            "value": "FTP Brute Force"
          },
          {
            "label": "MITRE",
            "value": "T1110"
          },
          {
            "label": "Stage",
            "value": "Credential Access"
          },
          {
            "label": "Severity",
            "value": "Medium"
          },
          {
            "label": "Event",
            "value": "2/2"
          }
        ],
        "timestamp": "2020-02-14T04:21:26.532921+00:00"
      }
    ],
    "phases": [
      {
        "phase": "connection",
        "started_at_seconds": 0.0,
        "step_count": 1,
        "steps": [
          {
            "index": 1,
            "offset_seconds": 0.0,
            "phase": "connection",
            "step_type": "connection",
            "icon": "🚪",
            "title": "CONNECTION ESTABLISHED",
            "details": [
              {
                "label": "From",
                "value": "172.105.218.213:60492.0"
              },
              {
                "label": "Port",
                "value": 21.0
              },
              {
                "label": "Protocol",
                "value": "FTP"
              },
              {
                "label": "Honeypot",
                "value": "dionaea"
              },
              {
                "label": "Username",
                "value": "sa"
              },
              {
                "label": "Password",
                "value": "saadmin"
              },
              {
                "label": "Auth attempts",
                "value": 1
              },
              {
                "label": "User attempts",
                "value": 1
              },
              {
                "label": "Pass attempts",
                "value": 1
              },
              {
                "label": "Attack type",
                "value": "FTP Brute Force"
              },
              {
                "label": "MITRE",
                "value": "T1110"
              },
              {
                "label": "Stage",
                "value": "Credential Access"
              },
              {
                "label": "Severity",
                "value": "Medium"
              },
              {
                "label": "Event",
                "value": "1/2"
              }
            ],
            "timestamp": "2020-02-14T04:21:26.532921+00:00"
          }
        ],
        "ended_at_seconds": 0.0
      },
      {
        "phase": "disconnect",
        "started_at_seconds": 0.0,
        "step_count": 1,
        "steps": [
          {
            "index": 2,
            "offset_seconds": 0.0,
            "phase": "disconnect",
            "step_type": "disconnect",
            "icon": "🔚",
            "title": "SESSION ENDED",
            "details": [
              {
                "label": "From",
                "value": "172.105.218.213:60492.0"
              },
              {
                "label": "Port",
                "value": 21.0
              },
              {
                "label": "Protocol",
                "value": "FTP"
              },
              {
                "label": "Honeypot",
                "value": "dionaea"
              },
              {
                "label": "Username",
                "value": "Administrator"
              },
              {
                "label": "Auth attempts",
                "value": 1
              },
              {
                "label": "User attempts",
                "value": 1
              },
              {
                "label": "Attack type",
                "value": "FTP Brute Force"
              },
              {
                "label": "MITRE",
                "value": "T1110"
              },
              {
                "label": "Stage",
                "value": "Credential Access"
              },
              {
                "label": "Severity",
                "value": "Medium"
              },
              {
                "label": "Event",
                "value": "2/2"
              }
            ],
            "timestamp": "2020-02-14T04:21:26.532921+00:00"
          }
        ],
        "ended_at_seconds": 0.0
      }
    ],
    "total_steps": 2
  },
  "events": [
    {
      "timestamp": "2020-02-14T04:21:26.532921+00:00",
      "username": "sa",
      "password": "saadmin",
      "source_ip": "172.105.218.213",
      "source_port": 60492.0,
      "destination_port": 21.0,
      "protocol": "FTP",
      "honeypot": "dionaea",
      "country": "Japan",
      "country_code": "JP",
      "asn": 63949,
      "attack_type": "FTP Brute Force",
      "mitre_technique": "T1110",
      "attack_stage": "Credential Access",
      "severity": "Medium",
      "auth_attempt": 1.0,
      "user_attempt": 1.0,
      "pass_attempt": 1.0,
      "anonymous": 0.0,
      "command_count": 0.0,
      "_event_index": 1,
      "_offset_seconds": 0.0
    },
    {
      "timestamp": "2020-02-14T04:21:26.532921+00:00",
      "username": "Administrator",
      "source_ip": "172.105.218.213",
      "source_port": 60492.0,
      "destination_port": 21.0,
      "protocol": "FTP",
      "honeypot": "dionaea",
      "country": "Japan",
      "country_code": "JP",
      "asn": 63949,
      "attack_type": "FTP Brute Force",
      "mitre_technique": "T1110",
      "attack_stage": "Credential Access",
      "severity": "Medium",
      "auth_attempt": 1.0,
      "user_attempt": 1.0,
      "pass_attempt": 0.0,
      "anonymous": 0.0,
      "command_count": 0.0,
      "_event_index": 2,
      "_offset_seconds": 0.0
    }
  ]
}